"Destino"|"Categoria"|"Atraccion"|"Comentario"|"Usuario"|"Calificación"|"Año"
"Vilcabamba"|"Rutas para senderismo‎"|"Sendero Cerro Mandango"|"¡Asegúrate de tener un buen calzado y de estar listo para una subida empinada y empinada! También se volvió bastante peligroso con el viento. No olvides protector solar: hay muy poca sombra allí. El descenso fue un poco nervioso también, pero lento y constante, estarás bien. Las …"|"Zayna"|"5"|"2018"
"Genovesa"|"Rutas para senderismo‎"|"Darwin Trail"|"El yate Genovesa te llema a varias atracciones y después te puedes quedar un rato anclado disfrutando de los amigos y la música. El bote es muy lindo, los tripulantes son muy serviciales, la música es increible. recomendado"|"felipesan"|"5"|"2013"
"Genovesa"|"Rutas para senderismo‎"|"Darwin Trail"|"Maravilloso para moverse cerca de rabihorcados, Swallow de cola, Lava Gull Gull y amarillo coronada Noche Heron. . . así como la abundante Sally Lightfoot. Paseo relajante con mucho para ver de cerca. La playa no es genial para el buceo. Es empinada significa el perfil y cloud …"|"chris p"|"4"|"2017"
"Genovesa"|"Rutas para senderismo‎"|"Darwin Trail"|"Es un aterrizaje mojado, así que prepárate. Usted verá un montón de pájaros; rojo y Nazca piqueros enmascarados, fragatas, gaviotas, garzas, fringilos y los sinsontes."|"Rschagrin"|"4"|"2016"
"Genovesa"|"Rutas para senderismo‎"|"Darwin Trail"|"Esto está bastante lejos de otras islas en las Islas Galápagos, y es básicamente un rock lleno de pájaros. Por supuesto, estábamos allí para los animales, y sin duda la oportunidad de ver aves agradable en todas las fases de la vida, pero parece que podría haber visto la mayoría …"|"grendelz"|"3"|"2016"
"Genovesa"|"Rutas para senderismo‎"|"Darwin Trail"|"Nos dejó en Prince Philip's steps y una vez que llegamos a la cima vimos lo que estábamos en para: piqueros enmascarados, piqueros, por todas partes. Fueron encaramado en las arbustos, caminando por el medio de la ruta y de anidación, justo al lado de. Había la familiar Nazca …"|"ImmerWandern"|"5"|"2015"
"Genovesa"|"Rutas para senderismo‎"|"Darwin Trail"|"Verá un montón de diferentes especies de aves en un paisaje bastante sorprendente en una pequeña y remota isla!"|"Julian L"|"5"|"2016"
"Genovesa"|"Rutas para senderismo‎"|"Darwin Trail"|"Esta es una corta caminata en Bahía de Darwin. Vimos leones marinos, red-garra boobies, nazca boobies, pájaros fragata, Sharp catalogado baja Finch, Tuna cactus con suaves tal vez tengan tableros (cola swallow Gull. Bien vale la pena el tiempo para ver algunas de estas muy de …"|"Scott8147"|"5"|"2015"
"Genovesa"|"Rutas para senderismo‎"|"Darwin Trail"|"nada realmente única sobre el Darwin Trail en Genovesa. Si su barco no parar aquí, te perdías muy poco y probablemente deben ser feliz que tuviera la oportunidad de tierra en otro lugar."|"jcanberra"|"2"|"2013"
"Puerto Villamil"|"Rutas para senderismo‎"|"El Túnel del Estero"|"Es una Modesta Oquedad Volcánica donde no hay mucho que observar, se encuentra cercana a la ""Playa del Amor"", en el sitio hay buena cantidad de Iguanas. Sugiero una corta visita si te encuentras en las inmediaciones. Disfruta de Isla Isabela porque: ¡La VIDA...es un VIAJE!"|"Miguemex"|"2"|"2018"
"Puerto Villamil"|"Rutas para senderismo‎"|"El Túnel del Estero"|"Es una cueva misteriosa, mágina custodiada por iguanas en la entrada, adentro tiene agua, no es muy grande."|"Anibal B"|"4"|"2018"
"Puerto Villamil"|"Rutas para senderismo‎"|"El Túnel del Estero"|"interesante atracción, creada por las lavas volcánicas. solo para ver y tomar fotos. no tengo más aportes para dar."|"Maria B"|"5"|"2018"
"Puerto Villamil"|"Rutas para senderismo‎"|"El Túnel del Estero"|"Se puede identificar el proceso eruptivo que se dio en la isla, se puede identificar como los flujos de lava pasaron por la isla"|"Cesar G"|"3"|"2018"
"Puerto Villamil"|"Rutas para senderismo‎"|"El Túnel del Estero"|"Solo un pequeño túnel de lava, no demasiado demasiado visto. Lugar aburrido. Puedes saltarte. Hay mejores lugares como centro de tortuga."|"whliu2001"|"2"|"2019"
"Puerto Villamil"|"Rutas para senderismo‎"|"El Túnel del Estero"|"Túnel de lava situado en la playa que termina en la grieta con, por lo que es posible echar un vistazo o entrar en el interior. El lugar está rodeado de iguanas."|"Jaroslav Nečas"|"4"|"2018"
"Puerto Villamil"|"Rutas para senderismo‎"|"El Túnel del Estero"|"Un túnel de lava que desemboca en el océano. Vale la pena el breve desvío en el camino 