"Destino"|"Categoria"|"Atraccion"|"Comentario"|"Usuario"|"Calificación"|"Año"
"Quito"|"Rutas para senderismo‎"|"Maquipucuna Reserve"|"Nos alojamos por 3 noches y cogimos el paquete Classic con todas las comidas y guía de fauna incluido. Tuvimos una cabaña lejos del Lodge pero que era espacioso y tenía una terraza encantadora con hamacas en las que relajarse y disfrutar de los sonidos de la selva y el río …"|"Ratty27"|"5"|"2014"
"Quito"|"Rutas para senderismo‎"|"Maquipucuna Reserve"|"Acabo de volver de 4 noches en Maquipucuna Cloud Forest Reserve. ha tenido una experiencia que cambia la vida de tantas maneras? Esto fue para mí. El silencio puro (con el único sonido que el río corriendo), el Arsenio increíble, Luis, y Carlos. Las dos mujeres cocineros que me …"|"sealizis"|"5"|"2014"
"Quito"|"Rutas para senderismo‎"|"Maquipucuna Reserve"|"Visitamos el Lodge con mi amigo - arriba examinada (6 abril, 2014). Es un lugar hermoso, y apreciamos lo está siendo hecho por el medio ambiente y para las personas locales. Sin embargo, estoy escribiendo para corregir un par de las respuestas de la dirección. me llamaron para …"|"stuart g"|"4"|"2014"
"Quito"|"Rutas para senderismo‎"|"Maquipucuna Reserve"|"Primero los aspectos positivos - río - formidable rushing encantador y un montón de pájaros, un buen sistema de Trail - fácil acceso a senderos. buena guía ornitólogo. El problema principal es que es demasiado caro para lo que te dan y no está bien gestionado. Primero la …"|"jcw721"|"4"|"2014"
"Quito"|"Rutas para senderismo‎"|"Maquipucuna Reserve"|"ha sido casi un año desde que estuve allí y la magia de Maquipucuna nunca me dejan. Soy una ávida explorer, les encanta el aire libre y la naturaleza y un gran lugar para relajarse, este es el lugar! Simple no complicado, lo suficientemente lejos de la ciudad la vida, hermoso …"|"Rochelle M"|"5"|"2013"
"Quito"|"Rutas para senderismo‎"|"Maquipucuna Reserve"|"Nos alojamos en el Lodge, y me va a revisar esa experiencia en otro lugar. Los colibríes no me decepcionó. Había mucho para ver todo el día. Me dijeron que no usar un flash de fotografiar, ya que no es bueno para ellos. Como un fotógrafo profesional y conocimientos del personal …"|"John D"|"3"|"2014"
"Quito"|"Rutas para senderismo‎"|"Maquipucuna Reserve"|"Después de 8 días seguidos de visitar las islas Galápagos mi familia y yo estuvimos encantados de relajarse y recargar las pilas en Maquipucuna. El ambiente es muy relajado, con hamacas ensuciando el lugar, todas las comidas (y delicioso!) y colibríes por todas partes. Nos …"|"Felicity H"|"5"|"2014"
"Quito"|"Rutas para senderismo‎"|"Maquipucuna Reserve"|"Nuestra familia disfrutó del ambiente relajante con hamacas y los colibríes y los sonidos de una corriente abajo el borboteo del lago Lodge ... ojalá nos hubiéramos quedado más tiempo. La comida era excelente y las habitaciones son cómodas. Desgraciadamente, no vimos el oso …"|"kanneh"|"4"|"2013"
"Quito"|"Rutas para senderismo‎"|"Maquipucuna Reserve"|"Acabo de regresar de una estancia de tres noches en una de las ""suites,"" y estoy totalmente de acuerdo con todas las críticas favorables. El sitio es precioso y relajante (incluyendo el sonido del río muy cercano a la noche); la comida es excelente (incluyendo los platos …"|"dennisfr"|"5"|"2013"
"Quito"|"Rutas para senderismo‎"|"Maquipucuna Reserve"|"Después de 13 años volví a Ecuador para visitar a mi familia. Esto no fue mi primer viaje a Maqui (me había ofrecido en mi juventud) pero fue sin duda la más abundante. No puedo decir lo suficiente sobre la experiencia - el lugar tiene que ser lo más parecido que te dan a un …"|"Fernando J"|"5"|"2013"
"Quito"|"Rutas para senderismo‎"|"Maquipucuna Reserve"|"Mi novio y yo volvimos esta semana de un mes en Ecuador y las islas Galápagos. todo el viaje fue increíble, por Maquipucuna fue indiscutiblemente mi parte favorita de todo nuestro viaje. Todo, y quiero decir todo, es increíble. La comida era el mejor que hemos tomado en todo …"|"Tori Z"|"5"|"2013"
"Quito"|"Rutas para senderismo‎"|"Maquipucuna Reserve"|"Hicimos un viaje de un día a el bosque nuboso desde Quito. estaba a unos 2 horas en coche y reservamos el viaje con excursiones de G. La primera cosa que se ve es la zona esterilizados y colibríes. Hay una constante bullicio de colibríes y vimos probable alrededor 100 en unos 30 …"|"Lilly_travelling_cat"|"4"|"2013"
"Quito"|"Rutas para senderismo‎"|"Maquipucuna Reserve"|"Bonito y relajante lugar. La comida era espectacular -- fresco para cada comida y comer al aire libre. Birding era una delicia -- como encontrar pequeñas joyas escondidas en el dosel del bosque. Nuestro guía, Arsenio, era alegre y extraordinario en su habilidad para ver aves y …"|"Jcstorr"|"5"|"2013"
"Quito"|"Rutas para senderismo‎"|"Maquipucuna Reserve"|"Me encantó este lugar. Tienen algunos senderos bien señalizados decentes, y la comida es excelente. Me gustó porque es sin duda fuera del circuito turístico. Un montón de oportunidades de observación, y si realmente tiene suerte podrá ver un oso oso!"|"Mat1lda"|"5"|"2012"
"Quito"|"Rutas para senderismo‎"|"Maquipucuna Reserve"|"reserva Maquipucuna es absolutamente increíble. Pasé una semana allí, y me lo pasé. El personal es fantástico para decir lo menos. No soy mucho en aves, pero fui aves casi cada mañana mientras estuve allí porque la variedad de especies y los guías están tan bien. Los guías …"|"Holly H"|"5"|"2013"
"Quito"|"Rutas para senderismo‎"|"Maquipucuna Reserve"|"No soy un ""ornitólogo"", pero al final del primer día me inscribirse para hacer la 6 a pie de aves de am. maquipacuna es increíble en su flora y fauna. El personal es amable y muy servicial. La comida estaba siempre bien preparada y sabroso. Llevamos a nuestros dos hijos …"|"MichelleandAlan"|"5"|"2013"
"Quito"|"Rutas para senderismo‎"|"Maquipucuna Reserve"|"Está a unos 2 horas en coche. Nos alojamos en Quito por sólo un par de noches y luego irnos a las Galápagos. Al llegar a la ciudad, yo no tenía interés en mirando más Iglesias, todo lo que quería hacer era llegar a las montañas. amigos de TripAdvisor me sugirió que vienen aquí. …"|"ringinthenewyear"|"5"|"2013"
"Quito"|"Rutas para senderismo‎"|"Maquipucuna Reserve"|"guías geniales, lleno de conocimientos. La comida también fue buena, el desayuno y el almuerzo. Las aves zumbido eran tan interesante, vibrante y colorido.Sin duda vale la pena el viaje desde Quito."|"bert015"|"5"|"2013"
"Quito"|"Rutas para senderismo‎"|"Maquipucuna Reserve"|"maquipucuna es un lugar maravilloso para disfrutar y apreciar el bosque nuboso. Estuvimos allí en 2013 FEB por dos noches y tres días. Es una reserva ecológica y un desarrollo de la comunidad. Fundada por Rodrigo Ontaneda y su esposa hace 25 años, la misión es conservar lo que …"|"Ben S"|"5"|"2013"
"Quito"|"Rutas para senderismo‎"|"Maquipucuna Reserve"|"Pasamos un día en Maquipucuna pero con la ayuda de un guía muy cualificada nos perspicaz un oso specticled unos 75 pies en un árbol por encima de nosotros. El oso fue Majestic en unos 350 libras y fue sobrecogedoras en su presencia. parecía como curiosos acerca de nosotros ya …"|"TheStuff2"|"5"|"2012"
"Quito"|"Rutas para senderismo‎"|"Maquipucuna Reserve"|"Recientemente tuvimos la suerte de pasar 3 días en Maquipucuna con el incomparable Arcenio como nuestra guía. En nuestra primera intención era hacer alguna observación de aves, pero el primer día vimos un oso oso. arcenio era aparte de él mismo con emoción como los osos no había …"|"Dinah S"|"5"|"2012"
"Quito"|"Rutas para senderismo‎"|"Maquipucuna Reserve"|"maquipucuna Cloud Forest Reserve Lodge es un lugar verdaderamente increíble en el bosque nuboso. Las cabañas rústicas son bastante grandes y cómodas. Habíamos reservado una suite de dos habitaciones con sala de estar y terraza con una hamaca para 2 parejas. La comida es …"|"Phyllis W"|"5"|"2012"
"Quito"|"Rutas para senderismo‎"|"Maquipucuna Reserve"|"maquipucuna bosque nuboso Ecolodge, es un lugar de belleza y tranquilidad, en el corazón de la selva Ecuatoriana de nubes, a sólo 50 km de Quito. Podrá respirar aire puro, visitar las cascadas, ser parte de la diversidad biológica única de el bosque nuboso y comer deliciosos …"|"NataliaEcu"|"5"|"2011"
"Quito"|"Rutas para senderismo‎"|"Maquipucuna Reserve"|"El viaje en coche a Maquipucuna en sí es muy interesante: los pequeños pueblos en el camino, una visión de la agricultura, los cambios en la vegetación y los cambios de altitud, etc. El alojamiento en sí es increíble (y cuartos de baño impecables), y es maravilloso cómo han …"|"416Traveller2013"|"5"|"2012"
"Quito"|"Rutas para senderismo‎"|"Maquipucuna Reserve"|"maquipucuna es un lugar fantástico por muchas razones. Es fácilmente accesible desde Quito, pero te sientes que estás un millón de millas de distancia. una vez que llegue a este hermoso bosque nuboso. Este corredor es el hogar de una variedad increíblemente diversa de fauna, …"|"AllAboutAdventure"|"5"|"2012"
"Quito"|"Rutas para senderismo‎"|"Maquipucuna Reserve"|"Esta es una reserva y Lodge, aislado en un hermoso bosque nuboso. Vi un número increíble de pájaros, colibríes, un tímido y un armadillo! El hotel es precioso, y uno siempre se siente la presencia del bosque. Sin embargo, no es como Mindo - no hay ninguna ciudad. A no ser que …"|"lfogg"|"4"|"2012"
"Quito"|"Rutas para senderismo‎"|"Maquipucuna Reserve"|"Me pareció que los colibríes era increíble! La caminata a través del bosque es resbaloso así que asegúrate de llevar zapatos para caminatas. El viaje a la reserva natural es muy pintoresco."|"kathielk"|"4"|"2011"
"Quito"|"Rutas para senderismo‎"|"Maquipucuna Reserve"|"Toda la naturaleza, puedes ir de camping, también. Es un lugar muy bonito y una muy buena experiencia ir allí para ver aves, distintos tipos de plantas y flores. es realmente precioso!"|"Elvira D"|"5"|""
"Quito"|"Rutas para senderismo‎"|"Maquipucuna Reserve"|"Estábamos en Quito febrero pasado y no nos decepcionó para hacer el viaje de 50 km para ver esta increíble zona. Es realmente encantado con una variedad de orquídeas que crecen especies salvajes por todas partes, tucanes y otras especies endémicas. Alquilamos un taxi para el día …"|"Sarshebert"|"5"|"2011"
"San Cristobal"|"Rutas para senderismo‎"|"Punta Pitt"|"La lancha se apegó al islote, y se puede ver los piqueros. No se hace descenso. Poco tiempo. Especies únicas."|"Roxy A"|"5"|"2017"
"San Cristobal"|"Rutas para senderismo‎"|"Punta Pitt"|"Es un lugar magico una playa hermosa una vista impresionante se destaca mucho por albergar a piquetos patas rojas"|"galeriasdelmar"|"5"|"2017"
"San Cristobal"|"Rutas para senderismo‎"|"Punta Pitt"|"En el tour 360 visitamos punta pitt, donde las aves rodeaban el lugar y nos permitio disfrutar de este hermoso paisaje. El costo del tour es de 140dls aprox y visita muchos de los lugares mas turisticos alrededor de la isla"|"PoloARG"|"4"|"2017"
"San Cristobal"|"Rutas para senderismo‎"|"Punta Pitt"|"Bellamente agreste lugar, con especies de aves unicas, como el Piquero de patas rojas...realice interesantisimo avistaje de aves, con binoculares desde la lancha, en la excursion ""360"", que recorre todo el entorno costero de la Isa de San Cristobal (la recomiendo, es …"|"Susy_Patagonia"|"5"|"2016"
"San Cristobal"|"Rutas para senderismo‎"|"Punta Pitt"|"En Galápagos a pesar de la publicidad y belleza de los iconos piqueros de patas azules, ver los de patas rojas es un privilegio mayor desde mi punto de vista. Me enteré que solo los puedes ver aquí en Punta Pitt y en Genovesa (isla solo por crucero para llegar). Mis hijos lo …"|"AdrianP1973"|"5"|"2015"
"San Cristobal"|"Rutas para senderismo‎"|"Punta Pitt"|"Disfruta de un dia inolvidable, disfruta con amigo o familia, de este lugar grandioso. Aqui podras observar los piqueros patas rojas y si tenemos algo de suerte podremos ver en el snorkel los tiburones."|"Planet Ocean"|"5"|"2015"
"San Cristobal"|"Rutas para senderismo‎"|"Punta Pitt"|"Yo hice el camino con una amiga , y la veradd es un lugar divino . Ves todo tipo de bichos , aves , animales de todo tipo. Recomiendo que vallan en algun tour o con guia. Yo lo realice caminando con una amiga pero ella es bióloga por lo que tenia todas las explicaciones , pero …"|"Vanchus"|"5"|"2015"
"San Cristobal"|"Rutas para senderismo‎"|"Punta Pitt"|"para llegar a punta pitt uno debe bookear un tur. Una vez ahi lo llevan a hacer snorkel . Es muy hermoso, las aguas cristalinas y la variedad de animales que se ven es increible. Para pasar un buen dia. Se los recomiendoa todos"|"karina_lagz"|"4"|"2015"
"San Cristobal"|"Rutas para senderismo‎"|"Punta Pitt"|"Ideal para hacer snorkel, muy bueno, lobos, tortugas, etc. muy recomendable y muy buena visibilidad."|"Mauro V"|"4"|"2015"
"San Cristobal"|"Rutas para senderismo‎"|"Punta Pitt"|"hice snorkel y a pesar de ser buzo la experiencia fue espectacular, lobos marinos todo el tiempo y el agua totalmente visible, no puede dejar de hacer snorkel"|"Maria Fernanda F"|"1"|"2015"
"San Cristobal"|"Rutas para senderismo‎"|"Punta Pitt"|"Desde el centro de interpretación, el sendero nos lleva a un sendero bien cuidado hacia la costa. No sé cuánto tiempo, pero caminamos por un buen (casi) dos horas de caminata a lo largo de la intencionalidad. Estos puntos son una pequeña subida y le da una vista de 180 grados …"|"Indiana_Jonesse"|"5"|"2017"
"San Cristobal"|"Rutas para senderismo‎"|"Punta Pitt"|"Nuestra caminata a Punta Pitt comenzó con un aterrizaje húmedo y procedieron del interior. Buenos zapatos para caminatas son útiles en este paseo, asegúrese de traer una toalla, así que puedes tener tus zapatos cuando desembarque en un aterrizaje húmedo y luego limpia los pies …"|"Joe B"|"5"|"2017"
"San Cristobal"|"Rutas para senderismo‎"|"Punta Pitt"|"Primer día, la primera isla y primera parada y veo la increíble vida salvaje. Me pregunto es este el comienzo y va a conseguir mejor o convertido en un climax anti, ya que ir a visitar otra isla. Vimos muchos tipos de pájaros, leones de mar, cangrejos."|"pioneertraveller"|"5"|"2016"
"San Cristobal"|"Rutas para senderismo‎"|"Punta Pitt"|"Mi marido y yo fuimos en un viaje de un día hasta Punta Pitt sólo debido a un cambio de planes de última hora por nuestro operador de buceo y estoy tan contento que no te lo pierdas. El viaje pasa algo increíble paisaje volcánico, una vista estupenda de truco de rock y Cerro …"|"TerriW1984"|"5"|"2016"
"San Cristobal"|"Rutas para senderismo‎"|"Punta Pitt"|"Yo soy la primera en admitir que no soy una persona pequeña en barco pero valió la pena venir aquí y ver todos 3 especies de piqueros, Frigatebirds y mucho más! Los barcos no vayas cada día, así que pregunta en la ciudad como a quien tiene un día completo (360 Tour) ir y cuando, …"|"Tikibird"|"5"|"2016"
"San Cristobal"|"Rutas para senderismo‎"|"Punta Pitt"|"El sendero es un poco empinadas y rocosas, así que necesitas tener buen equilibrio y buenos zapatos. Pero la caminata vale la pena. Vimos un montón de patas azules piqueros a metros del camino. Algunos sentados en un huevo. Cuando llegamos al final del camino, incluso vimos una …"|"service197"|"5"|"2016"
"San Cristobal"|"Rutas para senderismo‎"|"Punta Pitt"|"Otro desembarco mojado en una playa pero exhaustivamente. Diminuta peridots iluminan arena como diamantes. Vimos dos pequeños leones de mar jugando con un palo de senderismo cayó otro visitante. Nuestro guía fue capaz de recuperar. El sendero de las colinas es un poco complicado …"|"Bob J"|"5"|"2016"
"San Cristobal"|"Rutas para senderismo‎"|"Punta Pitt"|"Una buena caminata a través de algunos estrechos pasajes rocosos, una exigencia de la pena: Numerosos piqueros patas azules, incluyendo uno que puso un huevo, con su mate en hacer su danza registrada. Esnórquel en esta zona después de la caminata."|"BLtrvl"|"5"|"2016"
"San Cristobal"|"Rutas para senderismo‎"|"Punta Pitt"|"Buceo con los leones de mar es increíble. En el otro lugar, muchos tiburones punta blanca, rayas, mucho offishes"|"Gerard B"|"5"|"2016"
"San Cristobal"|"Rutas para senderismo‎"|"Punta Pitt"|"Vinimos aquí para ver el rojo explosivas de pie. Asegúrate de que compruebe con la compañía de la visita para averiguar cuando salen a ver rojo explosivas de pie porque solo se puede acceder por organizado y la excursión es sólo dos veces por mes en determinadas fechas."|"333lovetotravel888"|"5"|"2015"
"San Cristobal"|"Rutas para senderismo‎"|"Punta Pitt"|"La cuarta isla en nuestro crucero era bastante diferente con franjas enteras de algas marinas de las Galápagos floreciendo rojo cubriendo roca volcánica negra. La caminata en sí conseguimos el corazón más que el carácter suave paseos en otras islas. Muy necesario después de todo …"|"2checkingout"|"5"|"2015"
"San Cristobal"|"Rutas para senderismo‎"|"Punta Pitt"|"La razón principal por la que fuimos a Punta Pitt era ver boobies, pero sólo vimos unos pocos. Aún así, vimos un par de Red Boobies con patas de cerca."|"Blabbott"|"3"|"2015"
"San Cristobal"|"Rutas para senderismo‎"|"Punta Pitt"|"Hicimos una excursión a Punta Pitt boobies rojos para ver de pie. alabar al Señor que no sólo ver boobies rojas de pie, pero también boobies rojas de pie con toda la familia de papá y mamá. El buceo en Punta Pitt (no la playa) también era bueno. Vimos un montón de peces."|"333lovetotravel888"|"5"|"2015"
"San Cristobal"|"Rutas para senderismo‎"|"Punta Pitt"|"Nadamos una zona privada de playa con miles de peces diferentes. Gran lugar para fotografiar con patas azul boobies, leones de mar, cangrejos Sally Lightfoot. El área de la bahía estaba en calma y bebés de leones marinos nadamos justo con nosotros! Además, una pequeña isla de …"|"Vegasthompson"|"5"|"2015"
"San Cristobal"|"Rutas para senderismo‎"|"Punta Pitt"|"Vimos Punta Pitt como parte de la ""360 grados"" turístico que rodea la isla. En el día de nuestra visita, rough Seas nos causó a retraso para ~1 hora, lo que significaba que no tuvimos tiempo de desembarque en Punta Pitt. Precioso lugar, un montón de anidando boobies ... y estoy …"|"LMOverby"|"4"|"2015"
"San Cristobal"|"Rutas para senderismo‎"|"Punta Pitt"|"Estoy casi dudas a escribir esta crítica porque Punta Pitt es tan bonito, no soportaría para nada que te arruine este pedazo de paraíso. Tienes que tomar un guía naturalista con usted para ver esta zona y el viaje en barco para llegar allí es larga, pero definitivamente vale la …"|"Danielle G"|"5"|"2014"
"Tabacundo"|"Rutas para senderismo‎"|"Lagunas de Mojanda"|"La Laguna de Mojanda tiene unos hermosos paisajes, recomendación es ir bien abrigados, están a 3800 metros, se sacan fotos muy lindas"|"Carolina R"|"4"|"2019"
"Tabacundo"|"Rutas para senderismo‎"|"Lagunas de Mojanda"|"El fin de semana tuve la oportunidad de ir a este hermoso lugar con mi hijo y sus amigos, para tomar unas fotografías y disfrutar por unas horas de la vista que brinda Mojanda y sus tres lagunas, hacía un poco de frío, incluso lluvió un poco, pero eso no nos desanimó a hacer una …"|"Jorge V"|"5"|"2019"
"Tabacundo"|"Rutas para senderismo‎"|"Lagunas de Mojanda"|"El camino es un poco duro, tanto si se va en Coche como caminando. Es muy recomendable subir en un carro 4x4 ya que son los únicos capaces de sortear los obstáculos presentes en la vía (sobretodo en invierno). Los coches llegan hasta el refugio en donde se puede alquilar cabañas …"|"David E"|"5"|"2018"
"Tabacundo"|"Rutas para senderismo‎"|"Lagunas de Mojanda"|"Hermoso lugar; pura naturaleza, aire puro; lugar propicio para hacer caminatas, camping, pesca.. La carretera de acceso desde Tabacundo lastrada y no muy buena, pero hermoso el paisaje.. Existe alojamiento en cabañas a precios convenientes. Excelente experiencia para quienes …"|"Yadira A"|"5"|"2018"
"Tabacundo"|"Rutas para senderismo‎"|"Lagunas de Mojanda"|"Lindo paseo realizado en familia, naturaleza, tranquilidad. Visitamos la laguna grande de Mojanda via Otavalo, es la mejor manera de llegar en auto pequeño, camino empedrado, lindos paisajes, lo único negativo es que se ve basura en los senderos. La gente debe ser más conciente …"|"voyagerQuito"|"5"|"2018"
"Tabacundo"|"Rutas para senderismo‎"|"Lagunas de Mojanda"|"Un hermoso lugar totalmente apartado para disfrutar de un paisaje inigualable. En verano el camino es accesible puedes llegar en vehículos altos que no necesariamente sean 4x4. Recomendable para acampar y realizar una deliciosa parrilla o pic nic. Debes ir con ropa adecuada para …"|"Ramiro A"|"5"|"2018"
"Tabacundo"|"Rutas para senderismo‎"|"Lagunas de Mojanda"|"Hermoso destino ecológico, en un extinto volcán. Se puede acampar y hacer senderismo. Perfecta comunión con la naturaleza."|"Juan Carlos D"|"5"|"2017"
"Tabacundo"|"Rutas para senderismo‎"|"Lagunas de Mojanda"|"Un lugar increible, lo unico malo de este lugar es el camino de acceso aunq no es muy dificil llegar, yo lo hice con un automovil pero recomiendo se llegue a este lugar con un carro alto, despues de eso espectacular, llegamos en la noche a acampar existe un guardia por lo que es …"|"Javier P"|"4"|"2017"
"Tabacundo"|"Rutas para senderismo‎"|"Lagunas de Mojanda"|"Aunque el camino para llegar desde Tabacundo no es muy bueno, vale la pena llegar a las lagunas la cual está rodeada de impresionantes montañas y unos paisajes maravillosos"|"FIFO555"|"5"|"2017"
"Tabacundo"|"Rutas para senderismo‎"|"Lagunas de Mojanda"|"Ideal para desconectarse un fin de semana del ritmo de vida de la ciudad. Está zona ofrece la posibilidad de realizar un treking de aproximadamente unas 6 horas para conocer las 4 lagunas que se encuentran en la zona siendo la más popular y la más visitada la laguna Grande. …"|"Gonzalo_89RS"|"5"|"2017"
"Tabacundo"|"Rutas para senderismo‎"|"Lagunas de Mojanda"|"A una hora y veinte de Quito, quedan las bellas lagunas de Mojanda, un paisaje de sierra combinado con la tranquilidad de sus aguas es un paisaje digno de ser visitado y admirado. El campamento cuenta con área de camping, bbq, y hay unas cabañas donde los visitantes pueden …"|"Christian Torres"|"5"|"2017"
"Tabacundo"|"Rutas para senderismo‎"|"Lagunas de Mojanda"|"Si te gusta la aventura deberías pensar en ir para allá, puedes ir al fuya fuya no es necesario equipo solo una buen par de zapatos y ropa abrigada. Lo vas a pasar genial"|"paguirre2017"|"4"|"2017"
"Tabacundo"|"Rutas para senderismo‎"|"Lagunas de Mojanda"|"Entre el frío y el paramo se encuentra este lugar, no existen negocios turisticos así que hay que venir con todo lo que necesites, no hay venta de comida, alquiler de botes, así que debes llegar con todo"|"makeithappenxc"|"5"|"2017"
"Tabacundo"|"Rutas para senderismo‎"|"Lagunas de Mojanda"|"Es un lugar excepcional para un paseo en familia, hay lugar para acampar o solo se puede hacer una caminata y disfrutar el medio ambiente, ya que este lugar esta escondido del mundanal ruido, se debe mejorar la ubicación en los mapas, la carretera es de segundo orden pero esta …"|"DARC1979"|"4"|"2017"
"Tabacundo"|"Rutas para senderismo‎"|"Lagunas de Mojanda"|"Las lagunas de mojada son preciosas, hay varios senderos para caminar o ir en bicicleta. También se puede subir al cerro Negro o al Fuya Fuya. MUY IMPORTANTE, utilizar la vida de entrada desde Otavalo porque la entrada desde Tabacundo esta en pésimo estado, hay mucho lodo e …"|"Sam P."|"4"|"2017"
"Tabacundo"|"Rutas para senderismo‎"|"Lagunas de Mojanda"|"Paseo familiar en el cual hicimos una comida al aire libre el lugar es muy hermoso pero deberia tener mas control y mayor actividad turistica en la laguna."|"418cristiana"|"4"|"2016"
"Tabacundo"|"Rutas para senderismo‎"|"Lagunas de Mojanda"|"Estuvimos con mi esposa ene ste lugar que es muy lindo por su entorno y porque también es un lugar apto para hacer campings, pesca y caminatas. Nosotros solo fuimos por el día pero vimos muchísimas carpas y hasta casi entada la noche seguín llegando adolescentes para hacer …"|"rama563"|"4"|"2016"
"Tabacundo"|"Rutas para senderismo‎"|"Lagunas de Mojanda"|"A una hora y media de Quito y fácil acceso; tiene logística para fines de semana y días feriados pero no tienes servicios los otros días. Es bueno para ir en familia y hacer un pic nic y lindo paisaje para fotografías."|"Edgar S"|"3"|"2016"
"Tabacundo"|"Rutas para senderismo‎"|"Lagunas de Mojanda"|"He ido varias veces a esta laguna es una de las más bonitas que conozco, actualmente cuenta con cabañas para dormir, lugares para bbq, baños. Lo único malo por decirlo de alguna manera es que el camino cuando llueve se pone peligroso y los vehíclos suelen quedarse atascados, …"|"Carlos M"|"4"|"2016"
"Tabacundo"|"Rutas para senderismo‎"|"Lagunas de Mojanda"|"Una caminata exquisita desde Malchingui por tierras cultivadas, bosques primarios, páramo y senderos para culminar llegando a ese mágico lugar en los andes del norte ecuatoriano, llevar ropa abrigada y leña para fogata. Es seguro y los guías nativos son muy amables. Recomendado"|"Rodrigo N"|"5"|"2016"
"Tabacundo"|"Rutas para senderismo‎"|"Lagunas de Mojanda"|"la subida es fuerte y se debe ir en carro alto, pero ya al llegar se lleva una impresión muy grande al ver la majestuosidad de la naturaleza."|"TURISTASEcuador2016"|"5"|"2016"
"Tabacundo"|"Rutas para senderismo‎"|"Lagunas de Mojanda"|"Las lagunas de mojanda son un excelente lugar para acampar y para salir de la rutina y distraerse, Es un paisaje muy hermoso donde se puede disfrutar con la familia amigos, y con las nuevas modificaciones que ha realizado el Canton Pedro Moncayo, tenemos cabanas, y la opcion de …"|"gr7gary"|"5"|"2016"
