"Destino"|"Categoria"|"Atraccion"|"Comentario"|"Calificacion"|"Anio"
"Puerto Ayora"|"Formaciones geologicas‎"|"Las Grietas"|"El paisaje es raro pero sorprende, se llega desde Puerto Ayora. Hay que tomar un taxi lancha que va a playa Los Alemanes, bajar en el muelle y caminar. Se pasa por la playa, se sigue caminando hasta una salina y caminando un poco mas se llega a Las Grietas. Es gratuito y esta …"|"5"|"2016"
"Puerto Ayora"|"Formaciones geologicas‎"|"Las Grietas"|"Muy bonito lugar, no obstante es prescindible, trate de ir dia semana el fin de semana se colmata de gente, y por la luz la mejor hora para recibir sol es al medio dia.-"|"3"|"2016"
"Puerto Ayora"|"Formaciones geologicas‎"|"Las Grietas"|"Ya son cinco veces que voy a santa Cruz y es un lugar que no dejo de visitar, es recomendable que lleves tu equipo de snorkel!"|"4"|"2016"
"Puerto Ayora"|"Formaciones geologicas‎"|"Las Grietas"|"Es un lugar donde puedes nadar, no es muy bueno para hacer snorkel porque no hay mucho que ver, pero se puede nadar muy tranquilamente"|"5"|"2016"
"Puerto Ayora"|"Formaciones geologicas‎"|"Las Grietas"|"Las grietas es una atraccion al otro lado de la isla, tienen q cruzar con una lancha taxi cuesta 1 dolar por 5 min al llegar al otro extremo la caminata es aproximada de 40 mi. Por eso recomiendo do llevar ropa y zapatos adecuados y una maleta al llegar a las grietas hay un …"|"5"|"2016"
"Puerto Ayora"|"Formaciones geologicas‎"|"Las Grietas"|"Un oasis en medio de la isla, permite disfrutar de la adrenalina en un lugar calido, 100% natural, con aguas calientes, un paisaje encantador, se debe caminar para llegar al lugar, bajando y subiendo escaleras"|"4"|"2016"
"Puerto Ayora"|"Formaciones geologicas‎"|"Las Grietas"|"Excelente lugar para ir a cualquier hora, el agua es fria pero vale la pena, no olvidar llevar el visor. Al regreso puedes pasar a la playa de los Alemanes, obviamente si la marea esta alta se disfruta de lo contrario no funciona."|"5"|"2016"
"Puerto Ayora"|"Formaciones geologicas‎"|"Las Grietas"|"Para llegar a las grietas primero hay que ir al malecon y pedir a una lancha que te cruce hacia el muelle de la playa de los alemanes, cuesta 1 usd, luego hay que caminar unos minutos y se llega a la playa de los alemanes, siguendo el camino estan las salinas y un hermoso …"|"4"|"2016"
"Puerto Ayora"|"Formaciones geologicas‎"|"Las Grietas"|"Interesante el lugar donde enconteamos agua dulce de lluvia y salada del mar . Se pueden baniar. un poco fria el agua ..."|"5"|"2016"
"Puerto Ayora"|"Formaciones geologicas‎"|"Las Grietas"|"Pero es un lugar que hay que ir a conocer, es pintoresco, el camino esta bueno, pero no es una de las atracciones mas interesantes de Galapagos"|"3"|"2016"
"Puerto Ayora"|"Formaciones geologicas‎"|"Las Grietas"|"Recorrer los senderos de lava para llegar a las grietas en Puerto Ayora es increible. Variedad de especies, lindo paisajes. Llegar para nadar en cristalinas aguas a temperatura moderada."|"5"|"2016"
"Puerto Ayora"|"Formaciones geologicas‎"|"Las Grietas"|"Un lugar obligado para conocer y disfrutar del paisaje en Galapagos ,Santa Cruz ,Puerto Ayora ,es las Grietas un regalo de la Naturaleza para llegar se debe tomar una panga ( bote pequenio) taxi..en el muelle de pasajeros precio varia de 1 dolar a 5 ,segun el lugar donde les …"|"5"|"2015"
"Puerto Ayora"|"Formaciones geologicas‎"|"Las Grietas"|"Las grietas es una formacion rocosa a manera de acantilado con una piscina natural de agua cristalina, ideal para sacarse una fotografia. El sendero es corto, y se puede llegar hasta el final de la grieta, en la cual se tiene una hermosa vista de Puerto Ayora y el muelle. Lo …"|"5"|"2016"
"Puerto Ayora"|"Formaciones geologicas‎"|"Las Grietas"|"El sitio es lugar obligado de visita, y evidencia el origen volcanico de la isla, y como los anios la transformaron"|"4"|"2016"
"Puerto Ayora"|"Formaciones geologicas‎"|"Las Grietas"|"Lugar visitado como parte de un tour de bahia, lo recomiendo 100% por sus particularidades (como suelos de sal color rosa o el agua de las grietas de profundo color turquesa). Lamentablemente el dia de la visita habian muchisimos turistas, por lo que para desplazarse o hacer …"|"4"|"2016"
"Puerto Ayora"|"Formaciones geologicas‎"|"Las Grietas"|"Un lugar tranquilo se pueden observar peces, buena vista Recomendado para pasar la tarde tiene mucha sombra."|"3"|"2016"
"Puerto Ayora"|"Formaciones geologicas‎"|"Las Grietas"|"Muy lindo lugar , aunque el agua estaba fria para nuestro gusto, y lo malo que cuando fuimos habia mucha gente y una de mis amigas extravio sus gafas. sin embargo vuando regresamos ya no hubo mucha gente y disfrutamos mejor"|"4"|"2016"
"Puerto Ayora"|"Formaciones geologicas‎"|"Las Grietas"|"Las Grietas es un sitio encantador; ideal para nadar y hacer snorkeling tranquilo y seguro...a mi me gusta!"|"4"|"2016"
"Puerto Ayora"|"Formaciones geologicas‎"|"Las Grietas"|"Las Grietas son un lugar muy interesante de visitar .Estan muy cerca del muelle de Puerto Ayora , se puede acceder tomando un tour o tomando un bote (fibra ) y despues de una breve caminata llegar a ellas. Aca a traves de miles de anios y movimientos teluricos se formaron unas …"|"4"|"2016"
"Puerto Ayora"|"Formaciones geologicas‎"|"Las Grietas"|"El camino es un poco descuidado pero al llegar descubres un paraiso. Lugar de aguas turquesas entre dos rocas, totalmente calmado."|"5"|"2016"
"Puerto Ayora"|"Formaciones geologicas‎"|"Las Grietas"|"Llevar su equipo para snorkel y chaleco salvavidas para ninios, no se van a hundir pues es salado y te saca a flote, pero si su ninio es pequenio se va a sentir seguro solo con el chaleco. Y los snorkels son para que puedan apreciar la profundidad de Las Grietas que es …"|"5"|"2016"
"Puerto Ayora"|"Formaciones geologicas‎"|"Las Grietas"|"Al igual que muchas atracciones en la isla, madrugar ayuda. La marea baja y poca gente garantiza que puedas disfrutar este lugar. Es obligatorio saber nadar, una vez que entras en el agua hay pocos sitios para sujetarse en las paredes. Se puede empezar a hacer snorkeling aqui …"|"5"|"2016"
"Puerto Ayora"|"Formaciones geologicas‎"|"Las Grietas"|"Es un sitio cercano a la muelle de Puerto Ayora, se accede caminando y se puede ir sin guia. Es ideal para que los ninios pequenios se adapten a utilizar el snorkeling."|"4"|"2016"
"Puerto Ayora"|"Formaciones geologicas‎"|"Las Grietas"|"Para quienes deleitan de las aguas cristalinas, de las maravillas volcanicas... Las grietas son sin duda un lugar privilegiado qe hay que visitar. Si bien en algunos horarios suele estar muy lleno de visitantes, el espacio te permite alejarte a lugares mas privados en donde …"|"5"|"2016"
"Puerto Ayora"|"Formaciones geologicas‎"|"Las Grietas"|"Las Grietas es un lugar ideal para quienes quieran pasar un buen rato nadando. El suelo marino tiene una profundidad considerable por lo que hay que ser buen nadador para adentrarse alli. Lo unico malo es que es un lugar tan popular y tan pequenio que siempre esta completamente …"|"5"|"2016"
"Puerto Ayora"|"Formaciones geologicas‎"|"Las Grietas"|"Definitivamente hay que conocer las grietas! tanto el paseo como la caminata hasta llegar alli valen la pena. Y el lugar es simplemente sobrecogedor. El agua es cristalina se puede nadar junto a los peces."|"5"|"2016"
"Puerto Ayora"|"Formaciones geologicas‎"|"Las Grietas"|"Hermoso lugar apto para nadar entre peces. Muy concurrido.es un paseo obligatorio para todo visitante a la isla tambien se puede caminar por otros senderos."|"5"|"2016"
"Puerto Ayora"|"Formaciones geologicas‎"|"Las Grietas"|"Es un hermoso lugar, sin embargo el espacio para que la gente se aposte a sacar fotos, mirar, tirarse al agua, es muy pequenio."|"5"|"2016"
"Puerto Ayora"|"Formaciones geologicas‎"|"Las Grietas"|"Vale la pena recorrer hasta llegar. Y no olvidar el equipo d snorkel porque es posible ver algunos peces en todo el recorrido de la grieta. El banio es obligatorio."|"5"|"2016"
"Puerto Ayora"|"Formaciones geologicas‎"|"Las Grietas"|"A este lugar en mi ultimo viaje lo visite dos veces, es muy importante que sepas que esta actividad no tiene ningun valor es totalmente gratuita y en camino a las grietas pasas por las minas de sal, en donde vez sal natural que extraen y ademas pasas por la playa de los alemanes …"|"5"|"2016"
"Puerto Ayora"|"Formaciones geologicas‎"|"Las Grietas"|"De todos los sitios turisticos de Puerto Ayora me quedo con este, me encanto, las dos tonalidades del agua de mar y agua de lluvia, juntas pero no revueltas. Nade un buen rato alli y aunque el agua estaba fria el sitio era tan Hermoso q no queria salir de alli. Ideal para hacer …"|"5"|"2016"
"Puerto Ayora"|"Formaciones geologicas‎"|"Las Grietas"|"Para las personas que les encante realizar clavados perfecto. Una hermosa piscina natural y a pocos minutos del centro"|"5"|"2016"
"Puerto Ayora"|"Formaciones geologicas‎"|"Las Grietas"|"Bueno para llegar a este lugar se tiene que caminar un poco, se pueden observar algunas especies nativas de fauna y flora, personalmente cuando asisti pude observar dos pequenios tiburones martillo fue gratificante poder observar esta especie. Ademas aves propias del lugar y un …"|"5"|"2016"
"Puerto Ayora"|"Formaciones geologicas‎"|"Las Grietas"|"El agua es suuuper fria pero ya una vez adentro te acostumbras es lindo hacer snorkel hay muchos peces, es profundo de 3 y mas metros pero si no sabes nadar ahi te alquilan creo x $5 chalecos salvavidas y listo puedes disfrutar sin problemas... Camino a las grietas hay un …"|"5"|"2016"
"Puerto Ayora"|"Formaciones geologicas‎"|"Las Grietas"|"Luego de una caminata que no llega a ser extenuante se llega a las grietas, un brazo de mar pristino, muy bello y referscante, con fauna marina, incluso morenas, muy bonito"|"5"|"2016"
"Puerto Ayora"|"Formaciones geologicas‎"|"Las Grietas"|"Muy chevere para hacer snorquel, para ninios pequenios que no naden bien llevar flotadores, para que esten tranquilos, y las mascaras de esnorquel, hay muchas piedras y para que puedan ir a las otras piscinas naturales ir con zapatos para nadar."|"5"|"2016"
"Puerto Ayora"|"Formaciones geologicas‎"|"Las Grietas"|"Para ir al lugar necesitas llegar a Puerto Ayora em Santa Cruz y tomar un taxi lancha y por 80 centavos de dolar llegaras aun sendero que te lleva a este hermoso lugar.... De aguas turquesas entre ricos de piedras gigantes puedes hacer snorkel con peces aqui.."|"5"|"2016"
"Puerto Ayora"|"Formaciones geologicas‎"|"Las Grietas"|"El camino a pie hasta Las Grietas es bonito. Sin embargo, cuando arribe desde Playa de los Alemanes, me halle con demasiada gente, muchachos y ninios zambullendose sobre el agua (muy cristalina, de color turquesa, pero muy fria). La verdad es que el lugar es encajonado, ya que se …"|"3"|"2016"
"Puerto Ayora"|"Formaciones geologicas‎"|"Las Grietas"|"un lugar imperdible de visitar y hacer snorkel , pasando la primera grieta que es muy bonita y agua muy cristalina , despues de las piedras hay una segunda grieta con una fauna subacuatica preciossa y podes nadar muy tranquilo ya que no hay corriente y es muy clarito"|"5"|"2016"
"Puerto Ayora"|"Formaciones geologicas‎"|"Las Grietas"|"Es una zona de banio bastante escondida, pero vale la pena. Consiste en una separacion en la roca definida por dos paredes casi verticales de unos 20m de altura y 5-10m de ancho. Se accede por unas escaleras tras hacer un pago y se lo puede baniar en el agua."|"4"|"2015"
"Puerto Ayora"|"Formaciones geologicas‎"|"Las Grietas"|"Paisaje increible. Es un lugar indispensable dentro de la visita a las islas galapagos. Sugiero llevar gorro y bloqueador, hace mucho calor¡"|"5"|"2016"
"Puerto Ayora"|"Formaciones geologicas‎"|"Las Grietas"|"Muy lindo el paseo hasta llegar a las grietas, ya que paisajisticamente y las casas y hoteles de esta mini peninsula son extremadamente pintorescas. Ideal para fotografiar todo el camino."|"4"|"2016"
"Puerto Ayora"|"Formaciones geologicas‎"|"Las Grietas"|"Es una muy buena opcion gratuita para realizar snorkel . Desde el muelle de Puerto Ayora tomar un taxi acuatico , 0,50ctvs de dolar y cruzar hasta el muelle de la Bahia Finch . Desde alli nos queda caminar por un camino muy bien marcado que nos llevara luego de 30 min hasta Las …"|"4"|"2016"
"Puerto Ayora"|"Formaciones geologicas‎"|"Las Grietas"|"Las grietas como su nombre lo menciona, es un lugar donde el sol casi no llega por lo cual las aguas son completamente frias, un lugar delicioso para poder descanzar del caluroso clima"|"5"|"2015"
"Puerto Ayora"|"Formaciones geologicas‎"|"Las Grietas"|"Fuimos a media maniana, casi mediodia. El mejor horario para visitarlo, ya que comienza a entrar el sol. Hermoso lugar, indescriptible. El agua, muy fria. Vale la pena para nadar tranquilo, hacer snorkel. Si se cruza las piedras que estan al fondo, se puede continuar un poco mas …"|"5"|"2016"
"Puerto Ayora"|"Formaciones geologicas‎"|"Las Grietas"|"Parece incredible que estas aguas azules tengan pescados de 30-40-50 centimetros dentro, no olvides llevar tu snorkel, te sientes como en una pelicula!"|"5"|"2016"
"Puerto Ayora"|"Formaciones geologicas‎"|"Las Grietas"|"El lugar es precioso, pero es bastante visitado. Cuando fui estaba tan lleno de gente que me fue imposible entrar al agua. El lugar se arruina con todo el grito de la gente. Pero no deja de ser hermoso."|"3"|"2015"
"Puerto Ayora"|"Formaciones geologicas‎"|"Las Grietas"|"Como toda galapagos es un lugar ideal para quien disfruta del agua, la vida Marina y las aves. Las grietas no solo Don maravillosas para el sorteo sino que para llegar hay un bello camino por recorrer. Un consejo : llevar zapatillas anfibios para poder cruzar las piedras...."|"5"|"2016"
"Puerto Ayora"|"Formaciones geologicas‎"|"Las Grietas"|"Excelente panorama gratuito por un interesante camino lleno de vegetacion y fauna local. Indispensable llevar traje de banio y snorkel. De pronto puede estar un poco colapsado por la cantidad de gente que lo visita."|"5"|"2015"
"Puerto Ayora"|"Formaciones geologicas‎"|"Las Grietas"|"El lugar es bonito sobre todo si se hace snorquel pero suele haber bastante gente y tampoco hay muchos peces si eso es lo que buscas. Se puede visitar por tu cuenta sin tener que pagar ninguna tour."|"3"|"2016"
"Puerto Ayora"|"Formaciones geologicas‎"|"Las Grietas"|"Un lugar de otro planeta, no tiene muchas especies naturales pero es una muy buena practica para empezar a hacer snorkel. Llevar calzado para el agua, porque las piedras cortan mucho los pies."|"3"|"2016"
"Puerto Ayora"|"Formaciones geologicas‎"|"Las Grietas"|"Hermoso lugar de roca volcanica con entrada de agua de mar cristalina excelente para nadar y hacer snorkel"|"5"|"2016"
"Puerto Ayora"|"Formaciones geologicas‎"|"Las Grietas"|"Un excelente lugar para nadar y hacer snorkel. Aunque hay que caminar un poco el paisaje es muy especial. Definitivamente vale la pena. Hay que ir!"|"5"|"2016"
"Puerto Ayora"|"Formaciones geologicas‎"|"Las Grietas"|"Este sitio merece estar entre las primeras cosas por hacer en puerto Ayora ya que no necesitas de un guia y el costo es solamente del taxi que te lleva y te trae, algo asi como 1,60 USD. Hay que caminar unos 15 minutos, si se te olvido llevar agua o algo para tomar hay una …"|"5"|"2016"
"Puerto Ayora"|"Formaciones geologicas‎"|"Las Grietas"|"El camino es muy facil y cuando uno llega se puede meter a nadar o a hacer snorkling. Tambien se puede ir nadando desde las grietas hacia el mar. El agua es bellisima y esta repleto de peces. Imperdible!"|"5"|"2016"
"Puerto Ayora"|"Formaciones geologicas‎"|"Las Grietas"|"Si te gusta nadar este es el lugar ideal! Una piscina de unos 50 metros entre paredes de roca de lava donde puedes hacer snorkel y nadar tranquilamente."|"4"|"2016"
"Puerto Ayora"|"Formaciones geologicas‎"|"Las Grietas"|"Sin duda alguna un excelente lugar para poder apreciar diferentes tipos de peces y no solo eso durante el camino hacia este lugar puedes deviarte hacia los miradores desde los cuales tendras una excelente vision sobre la localidad"|"5"|"2016"
"Puerto Ayora"|"Formaciones geologicas‎"|"Las Grietas"|"Un lugar muy lindo. Se toma un taxi acuatico de 0,80 dolares y se llega a playa los alemanes donde se puede baniar y se ven rayas, tortugas marinas e iguanas. Se toma un sendero y se va a las grietas pasando por un salar. Yo no me banie pero mucha gente lo hacia y disfrutaba. …"|"5"|"2016"
"Puerto Ayora"|"Formaciones geologicas‎"|"Las Grietas"|"La vista es hermosa y estar flotando en la grieta es muy relajante. Al inicio el agua es helada, pero rapidamente te acostumbras. Trata de ir entre las 2 y 3 de la tarde que no esta la gente de los tours, suele estar vacio y es mas hermoso. Puedes tomar una lancha para llegar …"|"5"|"2016"
"Puerto Ayora"|"Formaciones geologicas‎"|"Las Grietas"|"Muy lindo lugar, cuando llegas te sientes pequenio en tan increible lugar, hay dos grietas en este lugar en la primera hay mucha gente en especial en las horas de mayor afluencia que serian de 10H00 AM a 12H00 PM y 16H00 a 18 PM, si vas en estas horas podrias nadar hasta la …"|"4"|"2016"
"Puerto Ayora"|"Formaciones geologicas‎"|"Las Grietas"|"Precioso lugar de agua salada super clara y profunda entre piedras, para nadar y hacer snorkel o relajarse despues de un dia de playa. Si vas con ninios llevar salvavidas. Es imperdible. Se puede visitar junto con la playa de los Alemanes que queda de pasada."|"4"|"2016"
"Puerto Ayora"|"Formaciones geologicas‎"|"Las Grietas"|"Nada lindo ni agradable que ofrecer. Fuimos un dia y estaba llenisimo de gente local baniandose, parece que es un lugar popular de recreacion para la gente que vive en galapagos, por lo que para turistas resulta bastante incomodo. No se disfruta el paisaje y no se puede baniar …"|"2"|"2016"
"Puerto Ayora"|"Formaciones geologicas‎"|"Las Grietas"|"Es un lugar muy lindo! Conviene ir en la maniana temprano porque hay menos gente y llega mas sol a la Piscina! Si bien es increible nada en las pozas y hacer algo de snorquel, no se ven tantos peces!"|"4"|"2016"
"Puerto Ayora"|"Formaciones geologicas‎"|"Las Grietas"|"Linda grieta natural, aguas claras entre medio de ricas, el agua es mas fria eso si, se llega despues de un taxi (bote) tomado en ayora que sale 1 dolar (es como 2 minutos en este bote), luego se debe caminar unos 20 minutos, es pequenio eso si y se llena de gente, por lo que se …"|"4"|"2016"
"Puerto Ayora"|"Formaciones geologicas‎"|"Las Grietas"|"Un sitio muy bonito y tranquilo, pero es recomendable llegar antes de las 9h de la maniana, luego se llena."|"5"|"2016"
"Puerto Ayora"|"Formaciones geologicas‎"|"Las Grietas"|"Es una buena opcion para visitar en Puerto Ayora. Hay que tomar un taxi boat en el muelle que cruza al otro lado y despues caminar una media hora, pasando por la playa de los alemanes. El circuito es entretenido. En las grietas se puede nadar y hacer snorkel. Es un paseo …"|"4"|"2016"
"Puerto Ayora"|"Formaciones geologicas‎"|"Las Grietas"|"Un lugar muy lindo y relajante. Hay que hacer una caminata de unos / km para llevar pero vale la pena. Recomiendo llevar agua, ya que hace calor y en el lugar no venden."|"4"|"2016"
"Puerto Ayora"|"Formaciones geologicas‎"|"Las Grietas"|"Este es un lugar algo escondido, ya que se debe caminar bastante hasta encontrarlos. En el camino pasamos por una playa pequenia pero muy buena para refrescarse con tanto calor. Despues de unos 10 min de caminata, donde abundan las iguanas, pudimos llegar a las grietas! Es una …"|"5"|"2016"
"Puerto Ayora"|"Formaciones geologicas‎"|"Las Grietas"|"las grietas queda a pocos minutos de puerto ayora, hay que tomar un taxi acuatico en el embarcadero que cuesta 80 centavos y te deja en 5 minutos en la entrada del camino, ahi se accede primero a la playa de los alemanes, y luego en una caminata de 15 minutos, por un camino con …"|"4"|"2016"
"Puerto Ayora"|"Formaciones geologicas‎"|"Las Grietas"|"Una formacion rocosa que contiene un agua cristalina. Es un canal profundo entre las piedras. El agua esta fria pero se tolera o uno se distrae con el lugar y no se te pasa el frio. Esta habilitado hasta las 17hs."|"4"|"2016"
"Puerto Ayora"|"Formaciones geologicas‎"|"Las Grietas"|"para mi son las aguas mas cristalinas y bellas del mundo una vista hermoza y genial algo quen realmente vale la pena visitar"|"5"|"2016"
"Puerto Ayora"|"Formaciones geologicas‎"|"Las Grietas"|"Es bonito, sin embargo el pero de estas hermosas piscinas naturales radica en la misma falta de respeto de mi misma gente ecuatoriana ,fui en dos ocasiones ya que en la primera fue bonito fui en la maniana cerca al medio dia y en la segunda fui en la tarde y fue cuando me …"|"3"|"2015"
"Puerto Ayora"|"Formaciones geologicas‎"|"Las Grietas"|"Recomendacion: hacer esta visita saliendo de maniana,es cuando da el sol en la fisura y el agua no se siente tan fria, ademas hay menos gente y se puede disfrutar de manera plena. Llevar protector y snorkel. Y llegar hasta el final de la grieta, al fondo, alli se puede observar …"|"5"|"2016"
"Puerto Ayora"|"Formaciones geologicas‎"|"Las Grietas"|"Durante el viaje fui dos veces porque es un lugar realmente hermoso! Puedes nadar y relajarte, hacer snorkeling y saltar a las grietas!"|"5"|"2015"
"Puerto Ayora"|"Formaciones geologicas‎"|"Las Grietas"|"Despues de tanta playa ver esta entrada de agua entre paredes de roca es bonito, sobre todo al atardecer y si hay agua en las lagunas que encuentras de camino puedes ver flamingos. No os quedeis solo en las grietas, despues de un banio ( en el que espero no encontreis mucha …"|"4"|"2016"
"Puerto Ayora"|"Formaciones geologicas‎"|"Las Grietas"|"Caminar hacia su locacion con fuerte sol y llegar a sus aguas un tanto frias es realmente refrescante, las autoridades del parque ubicaron en la zona unas amplias escaleras que aunque su disenio evita posibles resbalones, es mejor tener cuidado, pues los pies descalzos y mojados …"|"4"|"2015"
"Puerto Ayora"|"Formaciones geologicas‎"|"Las Grietas"|"Hermosas grietas en cuyo interior se forma un gran canal de agua dulce y salada. Ideal para nadar. No es muy lejos caminando. Es necesario tomar un taxi maritimo que cuesta 80 centavos de dolar por persona esta despues de la playa de los alemanes. Canal profundo hermoso …"|"5"|"2016"
"Puerto Ayora"|"Formaciones geologicas‎"|"Las Grietas"|"Estan muy buenas las grietas, del puerto tienen que tomarse un taxi de agua de 80 centavos que los cruza y de ahi caminar 10 minutos aprox hasta llegar. Le dejan sus datos a un guarda parques y pasan por la playa de los alemanes , siguen caminando y llegan a las grietas. Los …"|"4"|"2016"
"Puerto Ayora"|"Formaciones geologicas‎"|"Las Grietas"|"Sin duda un lugar de relajacion para despues de una calida tarde. con su agua fria y transparente, uno puede descansar de los calores que la isla te aporta. especial para llevar snorkel o una GoPro"|"5"|"2016"
"Puerto Ayora"|"Formaciones geologicas‎"|"Las Grietas"|"Es una grieta natural de agua dulce rodeado de murallas de piedra, aunque hay bastante gente siempre. El agua esta bastante mas fresca que el agua del mar, pero agradable"|"5"|"2016"
"Puerto Ayora"|"Formaciones geologicas‎"|"Las Grietas"|"es un lugar bello pero muy agreste, de echo muchos guias te llevan a un solo balcon y por lo menos hay tres.... Tiene una baranditas precarias de madera y si te caes hay muuchos metro hasta el mar. Para llegar al lugar dnd se hace snorker hay q sortear un camino pedregoso y …"|"3"|"2016"
"Puerto Ayora"|"Formaciones geologicas‎"|"Las Grietas"|"Yo recien voy a viajar en Junio por mi cuenta ... me sirve de mucho sus opiniones pero alguien me puede ayudar!. Esta bien la ubicacion en el mapa? Ayuda porfis ... gracias"|"3"|"2016"
"Puerto Ayora"|"Formaciones geologicas‎"|"Las Grietas"|"Hermoso lugar para pasar media maniana o media tarde , se llega en ""bote- taxi"" desde puerto Ayora ... caminar por un sendero pasar la Playa de los Alemanes ...seguir el sendero ...son tres pozones grandes de agua sin acceso al mar ya que es una pared rocosa ..por lo que se puede …"|"5"|"2016"
"Puerto Ayora"|"Formaciones geologicas‎"|"Las Grietas"|"este lugar es para nadar y refrescarse! el agua es mas frio que la de mar, que es bastante calida. muy buen lugar para terminar el dia. Cierra a las 1730! se llega en lancha!"|"5"|"2016"
"Puerto Ayora"|"Formaciones geologicas‎"|"Las Grietas"|"Lugar Asombroso! Ame este lugar desde que llegue. Si bien el agua esta un poco mas fria que en otros lugares, la visibilidad de este lugar es impresionante. Recomiendo visitar las grietas, llevar su snorkel y su camara subacuatica. Ademas de la transparencia del agua, si tienen …"|"5"|"2015"
"Puerto Ayora"|"Formaciones geologicas‎"|"Las Grietas"|"Muy bonito! Hay que ir. Puedes hacerlo en tour (Tour de la Bahia que lo incluye) o tambien por tu cuenta. Recomiendo esto ultimo ya que te quedas el tpo que quieres. Tomas un taxi bote en muelle por un dolar o poco menos te atraviesan al otro lado. De ahi caminas 10 min y llegas …"|"5"|"2016"
"Puerto Ayora"|"Formaciones geologicas‎"|"Las Grietas"|"Es bueno el lugar, pero hay tanto por conocer, que no lo recomiendo como lo mejor. De cualquier manera hice snorkel y vale la pena"|"3"|"2015"
"Puerto Ayora"|"Formaciones geologicas‎"|"Las Grietas"|"En galapagos hay tantas cosas para hacer que es necesario priorizar, las grietas son un llamativo lugar pero es muy pequenio y se llena de gente muy rapido. Se puede hacer snorkel pero no se ve mucho a decir verdad. Si estan con el tiempo contado y tienen otras mejores opciones …"|"3"|"2016"
"Puerto Ayora"|"Formaciones geologicas‎"|"Las Grietas"|"EL agua es frio pero bien rico en un dia caluroso, la formacion de las rocas es hermoso. Es un lugar profundo asi que puedes saltar al agua con tranquilidad incl de altura."|"5"|"2016"
