"Destino"|"Categoria"|"Atraccion"|"Comentario"|"Calificacion"|"Anio"
"Puerto Ayora"|"Formaciones geologicas‎"|"Las Grietas"|"Sin duda merece la pena el esfuerzo para ir a pie a este precioso lugar. Llevar tu traje de banio si te gusta nadar. Hay una bifurcacion en el camino justo antes Las grietas en la bifurcacion de la derecha. Una vez que he visto, volver y toma la bifurcacion a la izquierda hasta …"|"5"|"2015"
"Puerto Ayora"|"Formaciones geologicas‎"|"Las Grietas"|"La sima muy guay de agua cristalina del mar formada por dos placas tectonicas cambiantes. Podra bucear o saltar desde una plataforma en las refrescantes aguas."|"5"|"2015"
"Puerto Ayora"|"Formaciones geologicas‎"|"Las Grietas"|"Gran lugar para bucear si no te importa ver vida marina. Puede tomar un taxi de agua, luego un paseo bastante largo para llegar a la grieta de las rocas con agua cristalina y fria. Muy decepcionante, ya que estabamos buscando para bucear con animales. Peligroso para entrar y …"|"2"|"2015"
"Puerto Ayora"|"Formaciones geologicas‎"|"Las Grietas"|"Supongo que es un buen lugar para ir con ninios pequenios que pueden disfrutar de los leones de mar tomar el sol en el muelle pero realmente si no tienes ninios hay muchas mejores cosas que hacer y ver en Puerto Ayora."|"3"|"2015"
"Puerto Ayora"|"Formaciones geologicas‎"|"Las Grietas"|"Un chapuzon en las cristalinas aguas refrescantes despues de un paseo a traves de ""bosques opuntia shadeless"" es precioso. Y desde la cima de la roca volcanica las vistas hacia Academy Bay son maravillosos!"|"5"|"2015"
"Puerto Ayora"|"Formaciones geologicas‎"|"Las Grietas"|"Las grietas es una fisura volcanica - parece un Gorge - que se extiende hacia el interior desde el mar. Es facil llegar a pie desde el hotel y hay interesantes vistas de la cima de la fisura. Hay una zona de banio, vigilada por los funcionarios del parque,, que no usamos pero que …"|"4"|"2015"
"Puerto Ayora"|"Formaciones geologicas‎"|"Las Grietas"|"La vista de las paredes grietas hechas de lava le dan al lugar una vista espectacular y nadar para ver a los peces en la parte de atras de las grietas. guardabosques del parque son muy simpaticos."|"5"|"2015"
"Puerto Ayora"|"Formaciones geologicas‎"|"Las Grietas"|"Esperaba algo mas. Podra baniarse en el agua. Cuando estuvimos alli, parecia mas una piscina publica. Hay demasiada gente en el agua. No era muy apetecible. Pude ver leones de mar"|"2"|"2015"
"Puerto Ayora"|"Formaciones geologicas‎"|"Las Grietas"|"Las Giretas es el lugar perfecto para darse un refrescante chapuzon en una singular entorno. La gran grieta en la planta baja esta llena de agua salada, muy profundo, con un par de peces. Asegurate de llegar tan pronto como sea posible, mas tarde en el dia, hace increiblemente …"|"5"|"2015"
"Puerto Ayora"|"Formaciones geologicas‎"|"Las Grietas"|"Merece la pena! Tome el taxi de agua (que es un placer en si mismo). El paseo es facil y agradable y las grietas es genial! agua cristalina y algun pescado."|"5"|"2015"
"Puerto Ayora"|"Formaciones geologicas‎"|"Las Grietas"|"Un lugar natural interesante para nadar y practicar el esnorquel, este lugar tiene 3 piscinas naturales, podria parecer miedo al principio, pero es una gran experiencia!"|"5"|"2015"
"Puerto Ayora"|"Formaciones geologicas‎"|"Las Grietas"|"Un canion muy interesante y con agua limpia para nadar. Lo unico malo es la caminata, pero bueno lo que son las vacaciones para?"|"4"|"2015"
"Puerto Ayora"|"Formaciones geologicas‎"|"Las Grietas"|"Fuimos a Las grietas en la tarde. Puedes llegar alli por coger un taxi (panga) de agua desde el puerto que solo cuesta $1 por persona. cruzar a la derecha de la bahia y bajar por el Angermeyer. Desde alli siga el camino por. Hay seniales que te ayuden a encontrar tu camino y. Se …"|"5"|"2015"
"Puerto Ayora"|"Formaciones geologicas‎"|"Las Grietas"|"Vimos peces de Gran tamanio en la segunda parte de las grietas. Vale la pena una visita. Estaba preocupado de que nuestras mochilas, que tenia que ser quedarse en tierra se pondria en peligro cuando volvimos, pero tienen un guardia que parecia muy competente. Todo estuvo muy bien …"|"5"|"2015"
"Puerto Ayora"|"Formaciones geologicas‎"|"Las Grietas"|"Asegurate de llevar una mascara y bucear porque el agua es increiblemente cristalino! Hermoso lugar para una o dos horas."|"5"|"2015"
"Puerto Ayora"|"Formaciones geologicas‎"|"Las Grietas"|"Mi familia y yo hicimos el pequenio taxi acuatico hasta el otro lado de la bahia, y luego hicimos una caminata de 15 minutos a las grietas. Fue absolutamente hermoso y muy divertido. Recomiendo llevar zapatos para el agua y su propio tubo (o alquilar tubos alli $4 ... pero es un …"|"5"|"2015"
"Puerto Ayora"|"Formaciones geologicas‎"|"Las Grietas"|"Este fue uno de los mejores momentos de mi viaje. Era una zona preciosa para nadar. Llevar equipo de buceo o alquiler de un local en el lugar. Cuando estuvimos alli alguien alterado un nido de las avispas, asi que ten cuidado con eso tambien. En general, fue un lugar estupendo …"|"5"|"2015"
"Puerto Ayora"|"Formaciones geologicas‎"|"Las Grietas"|"Despues de caminar alrededor de Santa Cruz por un poco, este lugar fue un lugar fresco fuera maravilloso. ¿Como llegar aqui? Simple. Pregunte por las grietas en la estacion del puerto y que se coge un taxi. Esta a unos cinco minutos en bote y cuesta $0.50 . Esta a unos 15-20 …"|"5"|"2015"
"Puerto Ayora"|"Formaciones geologicas‎"|"Las Grietas"|"Me encanto el paisaje volcanico que figuran en estas ""grietas grandes."" Muchas personas estaban nadando en un extremo y se ha perdido la belleza de la mas lejos."|"4"|"2015"
"Puerto Ayora"|"Formaciones geologicas‎"|"Las Grietas"|"Este lugar es precioso y muy divertido! El agua esta fria y refrescante tras el paseo para llegar alli es simplemente perfecto!"|"5"|"2015"
"Puerto Ayora"|"Formaciones geologicas‎"|"Las Grietas"|"Ignora lo que los ninios guias dicen, las grietas es muy accesible ahora y no es dificil llegar a las autoridades del parque han creado un camino hasta el final y construidas a madera a las rocas donde se puede llegar facilmente en el agua. Su profundidad, asi que no es bueno …"|"5"|"2015"
"Puerto Ayora"|"Formaciones geologicas‎"|"Las Grietas"|"Usted tendra a la caza y tomar un barco para .50 para llegar a ella. Pero cuando lo encuentras usted sera sorpresa de lo bueno que es."|"5"|"2015"
"Puerto Ayora"|"Formaciones geologicas‎"|"Las Grietas"|"El agua aqui es fresco y agradable, fresco y claro. Trae una mascara y bucear para poder explorar todo el camino hasta la diversion final. Hay unos cuantos cortos tuneles submarinos que son realmente!"|"5"|"2015"
"Puerto Ayora"|"Formaciones geologicas‎"|"Las Grietas"|"Este lugar es precioso. Os recomiendo llevar una camara porque hay una gran vista. El agua esta bastante fria pero si no te importa agua fria, adelante y nadar! Esto es lo que creo que es la mejor parte de este lugar: cuando te trae una goggle o practicar esnorquel y mirar …"|"4"|"2015"
"Puerto Ayora"|"Formaciones geologicas‎"|"Las Grietas"|"- El agua de la playa local taxi dulce es de 60 centimos desde la avenida principal. Es un buen lugar para pasar el rato, hacer un pequenio y esnorquel de caminata no es genial"|"5"|"2015"
"Puerto Ayora"|"Formaciones geologicas‎"|"Las Grietas"|"Es genial si te gusta practicar esnorquel. El pequenio lagun ofrece fantasticas oportunidades para ver los diferentes tipos de fauna marina en aguas tranquilas"|"4"|"2015"
"Puerto Ayora"|"Formaciones geologicas‎"|"Las Grietas"|"Visitamos Las grietas dos veces en una semana. En ambas ocasiones, el lugar estaba repleto de 10 anios de edad los ninios locales shrieking. Es dificil de subir de la ""piscina"" resbalosas en las escaleras de salida/escalera. Llevar repelente de insectos. Las vistas sobre la …"|"3"|"2015"
"Puerto Ayora"|"Formaciones geologicas‎"|"Las Grietas"|"Las grietas es una de las atracciones gratis que puede ser experimentado sin un recorrido. Por medio de esta nota Galapagos Aquatours ofrece este como una parte de su recorrido, no tome esta excursion ver nuestra critica por separado de esta atraccion en TripAdvisor. Las grietas …"|"4"|"2015"
"Puerto Ayora"|"Formaciones geologicas‎"|"Las Grietas"|"Fuimos una tarde muy concurrida, pero la exuberancia juvenil de todos los otros nadadores se agrego a la diversion. Como antiguas relativas de los programadores, estabamos mas lento para hacer que nuestro camino hasta el agua, nos quedamos mas cerca a los lados, y necesitamos la …"|"4"|"2015"
"Puerto Ayora"|"Formaciones geologicas‎"|"Las Grietas"|"hermosa lava canions mezclando tanto salados y agua dulce donde se puede tomar un banio relajante. Solo tienes que coger un taxi-barca en el puerto (0'60 centavos por persona) y luego siga el camino para unos 10-15 min. No hay mucho espacio para alojarse en The Rocks (evitar …"|"5"|"2015"
"Puerto Ayora"|"Formaciones geologicas‎"|"Las Grietas"|"Una corta caminata desde Puerto Ayora (tendra que tomar un taxi de agua). Ir por la maniana en un dia soleado, antes de que llegue una multitud. El agua es profunda, increiblemente cristalino, fresco, y tiene un color azul saturadas durante mucho tiempo. Tambien se pueden …"|"5"|"2015"
"Puerto Ayora"|"Formaciones geologicas‎"|"Las Grietas"|"Lo recomiendo altamente. Como he dicho, pensamos que la playa arenosa / Bay en nuestro camino a las grietas era mejor que ambos bahia de Tortuga y las grietas en si. Todo genial de ver y experimentar como explorar Puerto Ayora."|"5"|""
"Puerto Ayora"|"Formaciones geologicas‎"|"Las Grietas"|"Cool poca formacion volcanica y un excelente lugar para nadar. coger un taxi amarillo de agua desde el gran muelle en la explanada por 60 centimos cada camino para llegar alli y volver. llegar temprano por la maniana para evitar las multitudes. Tuve que bajar la valla en la …"|"4"|"2015"
"Puerto Ayora"|"Formaciones geologicas‎"|"Las Grietas"|"El lugar es realmente estupendo (lleva algunos a pie). La mejor opcion es continuar nado o esnorquel y estancia en la tercera piscina, la cual no esta lleno de gente. El agua esta fria, asi que es mejor si usted lleve un traje corto para disfrutar del buceo. Tambien se …"|"4"|"2015"
"Puerto Ayora"|"Formaciones geologicas‎"|"Las Grietas"|"Es un bonito nadar, pero nada para planear su tiempo. IIT es un largo paseo a nadar en un abarrotado Canyon. Me coild solo lo recomendaria si tienes tiempo extra de sobra."|"3"|"2015"
"Puerto Ayora"|"Formaciones geologicas‎"|"Las Grietas"|"Esto merece la pena el paseo en un dia de calor ya que el agua esta a la sombra y frescas. El acceso al agua es resbaladiza y rocosa asi que ten cuidado. Es mas dificil salir de. La sima debe ser de al menos 25 m de profundidad pero es fresco y claro - gran visibilidad y facil …"|"5"|"2015"
"Puerto Ayora"|"Formaciones geologicas‎"|"Las Grietas"|"Es una caminata un poco para llegar alli, asi que para ancianos o ninios pequenios puede ser demasiado exigente; variedad de 6-60 anios debe ser seguro. Vaya en un soleado dia laborable antes de las 12 del mediodia si puedes, ya que tanto la playa ( ""Playa de los habiendo dejado …"|"4"|"2014"
"Puerto Ayora"|"Formaciones geologicas‎"|"Las Grietas"|"Es una playa estupenda! Hay demasiada gente en los fines de semana, intenta evitar que Intenta ir temprano por la maniana, asi que hay menos personas. paisaje impresionante. No te lo puedes perder!"|"5"|"2015"
"Puerto Ayora"|"Formaciones geologicas‎"|"Las Grietas"|"Mi amigo y yo fuimos y no esperabamos mucho, terminamos una maravilla!! El paseo para llegar alli es un agradable paseo. Puede saltar desde los acantilados y el agua es muy agradable! Ten cuidado cuando te dejan mochila en el suelo, tuvimos unas pequenias y simpatica ratones que …"|"4"|"2014"
"Puerto Ayora"|"Formaciones geologicas‎"|"Las Grietas"|"Me gusto mucho el buceo de superficie en el segundo (otra piscina) porque teniamos para nosotros incluso un domingo, cuando la otra piscina estaba lleno de mermelada con los lugarenios. No habia muchos peces, y teniamos la esperanza de encontrar un camino de salida hacia el …"|"3"|"2015"
"Puerto Ayora"|"Formaciones geologicas‎"|"Las Grietas"|"Si eres alergico a las abejas ... traiga su EPI pen ... estan por todas partes! Una vez que se llena y muchas personas lleguen los peces empiezan a ocultar ... Puedes seguir ... llegas, y ver una gran piscina ... nadar hasta el final y hay una piscina poco profunda que no …"|"3"|"2015"
"Puerto Ayora"|"Formaciones geologicas‎"|"Las Grietas"|"Es un hermoso lugar que tienes que ir y ver. Trae una mascara y bucear y nadar rapido para ver a los peces en el agua clara ultra. El modo en el que la luz refleja el agua es realmente increible. La caminata ida y vuelta es muy facil y puedes conseguir un helado en el camino …"|"5"|"2015"
"Puerto Ayora"|"Formaciones geologicas‎"|"Las Grietas"|"Este es un pequenio tesoro escondido. Fuimos dos veces, ambas en la maniana, y teniamos el lugar mayormente a nosotros mismos. Podiamos ir andando desde nuestro B&B, casa de Jean. El agua es tan transparente que puedes ver todo. Hay peces y rocas para ver. Tambien esta a un …"|"5"|"2014"
"Puerto Ayora"|"Formaciones geologicas‎"|"Las Grietas"|"Nos preguntabamos aqui, siguiendo otra gente, sin saber donde ibamos a ir. Tan precioso. No nos baniamos, asi que no puedo revision el agua pero fue plasmando a la vista. Me hizo querer ser un ninio otra vez."|"5"|"2015"
"Puerto Ayora"|"Formaciones geologicas‎"|"Las Grietas"|"Habia una advertencia de los guias lo que esperar. Entrada y salida peligroso debido a las rocas salientes. Es mejor no entrar a menos que se puede nadar. Los chalecos salvavidas disponibles, pero era no bajan hasta mucho mas tarde, y nadie nos dijo nada, y tuvimos que pedir. …"|"4"|"2015"
"Puerto Ayora"|"Formaciones geologicas‎"|"Las Grietas"|"Es un sitio muy chulo para una excursion a y vaya por un fresco y refrescante nadar y bucear. agua cristalina entre formaciones volcanicas. Ademas de lo mejor de todo es que es gratis!"|"5"|"2015"
"Puerto Ayora"|"Formaciones geologicas‎"|"Las Grietas"|"Es una increiblemente limpia y hermosa piscina natural de entrenamiento. el agua esta fria pero el buceo y natacion es impresionante."|"5"|"2015"
"Puerto Ayora"|"Formaciones geologicas‎"|"Las Grietas"|"Visitamos Las grietas como parte de un tour en domingo y estaba muy lleno. Quizas un dia de la semana es mejor, pero para nosotros no seria una visita especial proposito."|"3"|"2015"
"Puerto Ayora"|"Formaciones geologicas‎"|"Las Grietas"|"hermosa e interesante. Hay algunos peces que se convierten en atrapado asi que vale la pena coger un snorkel y mirar hacia abajo."|"5"|"2015"
"Puerto Ayora"|"Formaciones geologicas‎"|"Las Grietas"|"La primera vez que estuve aqui el chico en el frente de las puertas me dijo que tenia que esperar porque habia demasiada gente. Hacia calor y no contento con esto, pero al final me quede muy agradecido. Cuando llegue alli la mayoria de la gente habia dejado y luego fui a ver y …"|"5"|"2015"
"Puerto Ayora"|"Formaciones geologicas‎"|"Las Grietas"|"La naturaleza piscina que habia mucha gente limitadas, personas van alli para nadar, es hermoso, pero me siento como es una piscina con muchas personas nadar alli lo que permiten a solo una hora por persona para alojarse alli."|"2"|"2014"
"Puerto Ayora"|"Formaciones geologicas‎"|"Las Grietas"|"Vi este lugar como una obligacion en una guia. Primero, tienes que tomar un taxi-barco. Un minuto. 60 centimos. (de US$) luego a una puerta donde la gente es filtrada para evitar multitudes ; el lugar es pequenio. No se te permite estar mas de una hora. Pero por favor, no dejeis …"|"5"|"2015"
"Puerto Ayora"|"Formaciones geologicas‎"|"Las Grietas"|"Disfrutamos de nuestra breve nadar y bucear en estas claro, frio alimentadas por manantiales, aguas de un Gorge y la caminata. No consideramos que ""imprescindible"", pero es una buena actividad para hacer en Puerto Ayora si se dispone de tiempo."|"3"|"2014"
"Puerto Ayora"|"Formaciones geologicas‎"|"Las Grietas"|"Esta es una gran ""fuera del circuito turistico"" que lleva a una laguna con rock saltando y bucear. Una visita obligada en isla Santa Cruz."|"5"|"2014"
"Puerto Ayora"|"Formaciones geologicas‎"|"Las Grietas"|"Es un lugar divertido para visitar. Usted puede hacer esto en un medio dia. El camino no es muy lejos y es un poco mas dificil que la de Tortuga Bay. El agua es muy clara. Si se siente un poco salvaje, puede saltar desde lo alto de los acantilados de rocas en el agua."|"5"|"2014"
"Puerto Ayora"|"Formaciones geologicas‎"|"Las Grietas"|"Aunque fue oficialmente cerrado, todavia nos fuimos y otros habitantes seguido. El cliff Jump es seguro si sabes lo que estas haciendo, un monton de profundidad debajo sin ir a fondo. Pasamos las ultimas horas de luz del dia alli y disfrutamos de la soledad despues de los …"|"4"|"2014"
"Puerto Ayora"|"Formaciones geologicas‎"|"Las Grietas"|"Nos llevo unos 20-30 minutos a pie para llegar aqui y la puerta estaba cerrada, y me dijo que abrir sus puertas a finales de noviembre. Parece un poco frio desde el exterior, pero no pudimos entrar en ..."|"3"|"2014"
"Puerto Ayora"|"Formaciones geologicas‎"|"Las Grietas"|"El paseo a las grietas es quizas 45 minutos, y potencialmente bastante calido. Pero el paseo merece la pena! Las grietas es bastante ordenada. Prueba a subir a las rocas para las piscinas que estan mas lejos!"|"4"|"2014"
"Puerto Ayora"|"Formaciones geologicas‎"|"Las Grietas"|"Hermoso lugar y refrescante. Tome la mascara y aletas, asi que puedes bucear profundo y salida la roca grietas. Fuimos a 1/2 milla hacia el mar, escalada sobre diques naturales. Una gran aventura. Lleve zapatos para el agua (los aficionados, Aquasocks, etc) debido a Slick y …"|"5"|"2014"
"Puerto Ayora"|"Formaciones geologicas‎"|"Las Grietas"|"Tome un taxi acuatico hasta bahia de Finch, seguir camino al final de la playa. El sendero estaba cerrado el dia que me fui, con trabajadores reparar el sendero. No se permitio el acceso de todos modos, y estaba solo para la corta caminata. A pie de lava Rocks, asi que …"|"4"|"2014"
"Puerto Ayora"|"Formaciones geologicas‎"|"Las Grietas"|"Esto de la grieta era un buen sitio para pasear e incluso mejor nadar. Ve temprano en el dia, para evitar las multitudes y que lo disfrutes mucho mas."|"5"|"2014"
"Puerto Ayora"|"Formaciones geologicas‎"|"Las Grietas"|"Cogimos un 70% (por persona) taxi acuatico desde los muelles principales de justo al otro lado del agua y despues caminamos por el sendero senializado hacia Las grietas. Nos dimos cuenta que las seniales de la ciudad diciendo Las grietas habia cerrado el dia antes de llegar, y …"|"4"|"2014"
"Puerto Ayora"|"Formaciones geologicas‎"|"Las Grietas"|". muchos cristalinas agua de. tienes a escala los lados de las rocas hasta llegar a saltar desde - no es lo que esperaba, pero todavia muy divertido."|"4"|"2014"
"Puerto Ayora"|"Formaciones geologicas‎"|"Las Grietas"|"Este es un buen lugar, pero la verdad es que no se si merece la pena el esfuerzo de llegar hasta alli. Nosotros lo hicimos en una excursion al puerto y estaba incluido con otras tres cosas. Era bastante pequenia, pero bastante. Yo no saldria de mi camino a llegamos alli otra vez, …"|"3"|"2014"
"Puerto Ayora"|"Formaciones geologicas‎"|"Las Grietas"|"Las grietas es uno de los pocos atractivos en Santa Cruz que se puede llegar sin guia, y recomiendo encarecidamente que ese camino. Estaba molesto tener que pagar un taxi acuatico por unos dos minutos viaje (creo que era de alrededor 30 por persona, si recuerdo bien) pero eso …"|"4"|"2014"
"Puerto Ayora"|"Formaciones geologicas‎"|"Las Grietas"|"Mi marido y yo mojaron dando vueltas por la zona sin un guia o un grupo. El paseo es encantador en Las grietas, pero cuando llegamos a muchas personas. Era absolutamente precioso para ver el agua cristalina y de las rocas que lo rodean, pero habia demasiadas personas para …"|"4"|"2014"
"Puerto Ayora"|"Formaciones geologicas‎"|"Las Grietas"|"El paseo es a traves de una parte del Parque Nacional Galapagos y es bastante pintoresco. El agujero de natacion en si cuenta con aguas claras cristalinas rodeado de las paredes del canion. Llevar un traje de banio ..."|"5"|"2014"
"Puerto Ayora"|"Formaciones geologicas‎"|"Las Grietas"|"Wow, ¡no te pierdas las Galapagos. Parece muy bueno para ser viajar entre las numerosas islas de la las islas Galapagos, y se que la gente ecuatoriana estan trabajando muy duro para dejar estas islas sin explotar. Ya sea snorkeling, vela, o el senderismo, usted sera como …"|"5"|"2013"
"Puerto Ayora"|"Formaciones geologicas‎"|"Las Grietas"|"Los jovenes a disfrutar de verdad. Para oldies como yo el paseo desde la piscina de la ""plataforma"" es un poco dificil - y me falta la ""botella"" estos dias para saltar desde el acantilado. que se llena un poco partir de la hora del almuerzo."|"4"|"2014"
"Puerto Ayora"|"Formaciones geologicas‎"|"Las Grietas"|"Si se puede apreciar el paseo rocoso sobre el ""sitio"", es un pedazo de cielo. Estuve alli en marzo y el agua estaba fria pero no esta mal. Claro claro claro ese dia. Ah ... y el salto Cliff fue increible! Cuando regrese a Galapagos, me asegurare de aqui de nuevo."|"4"|"2014"
"Puerto Ayora"|"Formaciones geologicas‎"|"Las Grietas"|"Algo diferente que hacer en Galapagos. Use zapatos apropiados para caminar sobre las rocas de lava. Si no estaba lleno puedes bucear y ver algun pescado. El mejor momento para ir es durante la marea alta. Si eres un amante de las emociones fuertes, prueba a saltar de los bordes. …"|"5"|"2014"
"Puerto Ayora"|"Formaciones geologicas‎"|"Las Grietas"|"Llevar el bucear y si estas acostumbrado a estaciones mas calidas aguas del oceano ... Llevar un traje tambien. Entrada es un poco dificil, preparate para subir un poco ... Al final es uno de los lugares mas hermosos que he visitado ... Tienes que ir!"|"5"|""
"Puerto Ayora"|"Formaciones geologicas‎"|"Las Grietas"|"Desde una perspectiva geologica, fue un viaje de diversion. Pero no hay nada en el camino de la vida silvestre. El buceo no es buena y el agua estaba helada! El viaje lo hace por hermosas fotografias, pero no hay necesidad de pasar mas de 20 minutos en este escenario."|"3"|"2014"
"Puerto Ayora"|"Formaciones geologicas‎"|"Las Grietas"|"La caminata en si era hermosa, use sombrero y usar protector solar, llevar agua para beber-dieron unas fotos de iguanas marinas y la marisma, rocas de lava, y la zona de piscina en el camino hacia Las grietas. Tienes que subir rocas para llegar al agua fria, pero merece la pena …"|"4"|"2014"
"Puerto Ayora"|"Formaciones geologicas‎"|"Las Grietas"|"Si te gusta saltar rocas repisas, en aguas frias, en un entorno precioso, debe embarcarse en esta pequenia caminata interesante para llegar a las grietas. Saltar rocas no requiere...la natacion es una maravilla y la paredes de roca ofrecen sombra de sol del sol. Nuestro hijo, de …"|"5"|"2014"
"Puerto Ayora"|"Formaciones geologicas‎"|"Las Grietas"|"Un muy largo camino de innumerables rocas de lava llegan a un poco, escondida grotto. Varios fueron alli saltando y nadando en el agua. Mis musculos de la pierna eran bastante dolorida despues del paseo, y me considero a estar en buena forma. Gran ejercicio. No es seguro que la …"|"3"|"2013"
"Puerto Ayora"|"Formaciones geologicas‎"|"Las Grietas"|"Este es un viaje de un dia pero debe llevar calzado resistente y llevate una pequenia mochila. Yo no recomendaria este hotel para ninios menores de 8 anios. Vale la pena el precio de la excursion. Ademas, no te pierdas el extra $5 cada uno en el barco con fondo de cristal. Te dan …"|"4"|"2014"
"Puerto Ayora"|"Formaciones geologicas‎"|"Las Grietas"|"Cogimos un taxi acuatico desde el muelle principal al otro lado de la bahia. Digale al taxista que te va a las grietas y te dejara en frente de un hotel donde el claramente marcado sendero comienza. La caminata es de unos 30 minutos y la mayoria esta en abierto luz, asi que …"|"5"|"2014"
"Puerto Ayora"|"Formaciones geologicas‎"|"Las Grietas"|"Esta fue mi tercera visita a Las grietas. Era mi primer viaje mas alla de la primera piscina. En el extremo de la segunda piscina, a la derecha, vera un pasaje bajo las rocas. La distancia es de dos o tres metros, y si no lo hacen las consecuencias son bastante severas. La …"|"5"|"2014"
"Puerto Ayora"|"Formaciones geologicas‎"|"Las Grietas"|"Este es un lugar estupendo, visitamos como parte de un medio dia de excursion bahia de Puerto Ayora. El lugar estaba lleno cuando llegamos al punto donde apenas podiamos poner nuestras cosas en una roca. Despues de que los ninios (grupo de escuela) a la izquierda el lugar, de …"|"4"|"2014"
"Puerto Ayora"|"Formaciones geologicas‎"|"Las Grietas"|"Disfrutamos de la caminata a y la emocion de ser los primeros y unicos en la maniana."|"5"|"2014"
"Puerto Ayora"|"Formaciones geologicas‎"|"Las Grietas"|"Fuimos aqui como parte de un medio dia de duracion. sendero era mucho mas dificil de lo esperado y partes estuvieron bajo el agua. El sitio es muy impresionante, con las paredes y tienes que tener cuidado al bajar. algo, no buceo desde las rocas, y el agua estaba muy agradable. …"|"4"|"2014"
"Puerto Ayora"|"Formaciones geologicas‎"|"Las Grietas"|"Tome una excursion a la bahia, y te traen aqui. temerarios motoristas les encantara el saltando del acantilado, y los menos valientes personas les encantaran las vistas!"|"5"|"2014"
"Puerto Ayora"|"Formaciones geologicas‎"|"Las Grietas"|"no estabamos seguros de lo que era cuando fuimos alli pero vale la pena el paseo. Asegurate de que tienes equipo de natacion y coger un snorkel y mascara."|"4"|"2014"
